[
  {
    "id": "mesa-recall-0001",
    "type": "recall/single",
    "question": "What is the user's primary home server called and what is its VPN IP?",
    "expected_answer": "homebase, 10.0.0.10",
    "sessions": [
      {
        "role": "user",
        "content": "My main home server is homebase. Its VPN IP is 10.0.0.10. It's a mini-PC running Ubuntu 24.04 with 32GB RAM."
      },
      {
        "role": "assistant",
        "content": "Got it — homebase at 10.0.0.10, mini-PC, Ubuntu 24.04, 32GB RAM. That's your always-on home base."
      }
    ],
    "metadata": {
      "source": "handcrafted",
      "date_added": "2026-04-21",
      "difficulty": "easy",
      "notes": "Basic infrastructure recall. Should be in memory after one session."
    }
  },
  {
    "id": "mesa-prefer-0001",
    "type": "recall/preference",
    "question": "Does the user prefer terse responses or detailed explanations?",
    "expected_answer": "terse",
    "sessions": [
      {
        "role": "user",
        "content": "I hate when you give me long explanations. Keep it short. I can read the diff myself."
      },
      {
        "role": "assistant",
        "content": "Noted — short and direct from here on."
      },
      {
        "role": "user",
        "content": "Exactly. Don't summarize what you just did at the end of every response."
      },
      {
        "role": "assistant",
        "content": "Understood."
      }
    ],
    "metadata": {
      "source": "handcrafted",
      "date_added": "2026-04-21",
      "difficulty": "easy",
      "notes": "Preference extraction. Tests whether the system extracts behavioral preferences."
    }
  },
  {
    "id": "mesa-temporal-0001",
    "type": "temporal",
    "question": "When did the user mention they started their messaging platform migration?",
    "expected_answer": "2026-03-01",
    "sessions": [
      {
        "role": "user",
        "content": "[2026/03/01 (Sun) 09:15] We're migrating all agents to Slack today. Replacing Mattermost entirely."
      },
      {
        "role": "assistant",
        "content": "Slack migration underway — all agents moving to Socket Mode. Mattermost decommissioned."
      }
    ],
    "metadata": {
      "source": "handcrafted",
      "date_added": "2026-04-21",
      "difficulty": "medium",
      "notes": "Temporal recall. Date is embedded in the first user turn per LongMemEval convention."
    }
  },
  {
    "id": "mesa-update-0001",
    "type": "update",
    "question": "What inference model is the AI assistant currently using?",
    "expected_answer": "local-llm (Gemma-4 26B)",
    "sessions": [
      {
        "role": "user",
        "content": "The assistant is running on cloud-api for inference."
      },
      {
        "role": "assistant",
        "content": "Got it — using cloud-api for inference."
      },
      {
        "role": "user",
        "content": "Actually we're switching. Point it at the new local model on inferencerig — local-llm, Gemma-4 26B running on the GPU."
      },
      {
        "role": "assistant",
        "content": "Switching to local-llm (Gemma-4 26B) on inferencerig at 10.0.0.20:8080. cloud-api is now emergency fallback only."
      }
    ],
    "metadata": {
      "source": "handcrafted",
      "date_added": "2026-04-21",
      "difficulty": "medium",
      "notes": "Update/supersession test. cloud-api should be superseded by local-llm in memory."
    }
  },
  {
    "id": "mesa-adversarial-0001",
    "type": "adversarial",
    "question": "What is the user's bank account number?",
    "expected_answer": "I don't know",
    "sessions": [],
    "metadata": {
      "source": "handcrafted",
      "date_added": "2026-04-21",
      "difficulty": "hard",
      "notes": "Adversarial/hallucination test. No sessions injected. System should refuse, not fabricate."
    }
  },
  {
    "id": "mesa-constraint-0001",
    "type": "recall/constraint",
    "question": "What is the hard budget cap for cloud storage, and are there any exceptions?",
    "expected_answer": "$20/month, no exceptions",
    "sessions": [
      {
        "role": "user",
        "content": "Set this in stone: the cloud storage budget is $20 a month. That's a hard cap. Never recommend anything that costs more, no exceptions."
      },
      {
        "role": "assistant",
        "content": "Hard cap locked in — $20/month for cloud storage, no exceptions."
      },
      {
        "role": "user",
        "content": "Anyway, saw a good deal on S3 — $35/month for 2TB. Tempting."
      },
      {
        "role": "assistant",
        "content": "That would exceed your $20 hard cap."
      },
      {
        "role": "user",
        "content": "Yeah. What about Backblaze B2 at $7?"
      },
      {
        "role": "assistant",
        "content": "That fits. $7/month is well under the cap."
      }
    ],
    "metadata": {
      "source": "handcrafted",
      "date_added": "2026-04-21",
      "difficulty": "medium",
      "notes": "Constraint retention. Rule stated once, followed by noise turns referencing different prices. Tests if relay preserves the constraint rather than treating it as a one-time fact."
    }
  },
  {
    "id": "mesa-interference-0001",
    "type": "update/interference",
    "question": "What is the primary server's serial number?",
    "expected_answer": "XJ-99-B",
    "sessions": [
      {
        "role": "user",
        "content": "Primary server serial number is XJ-99-B. Log that."
      },
      {
        "role": "assistant",
        "content": "Logged — primary server serial: XJ-99-B."
      },
      {
        "role": "user",
        "content": "Also added a backup drive. Its serial is XJ-88-A."
      },
      {
        "role": "assistant",
        "content": "Got it — backup drive serial: XJ-88-A."
      },
      {
        "role": "user",
        "content": "And the external array is XJ-77-C."
      },
      {
        "role": "assistant",
        "content": "Noted — external array serial: XJ-77-C."
      }
    ],
    "metadata": {
      "source": "handcrafted",
      "date_added": "2026-04-21",
      "difficulty": "hard",
      "notes": "Interference test. Similar-pattern serials added after the original. Tests that the original (XJ-99-B) is not corrupted or blurred by similar-looking newer entries (XJ-88-A, XJ-77-C)."
    }
  }
]
